text,dominant_distortion,secondary_distortion
"People should be on time, and his lateness is a huge insult.",Should Statements,Magnification or Minimization
"If I go to the party, nobody will talk to me, because I'm always the wallflower.",Jumping to Conclusions,Overgeneralization
"I look okay, but my nose is too big, so I'm hideous.",Mental Filter,
"I look thin in this picture, but it's just the angle.",Disqualifying the Positive,
I gained an ounce; I'm a whale.,Magnification or Minimization,
"I won the raffle, but it was just dumb luck.",Disqualifying the Positive,
"I feel hopeless, so my future is dead.",Emotional Reasoning,
I forgot the milk; I'm losing my mind.,Magnification or Minimization,
"I am a burden, so they are better off without me, and I know they think so.",Labeling,Jumping to Conclusions
"I look strong, but I have a belly, so I look fat.",Mental Filter,
"I am a coward, and I always run away from my problems.",Labeling,Overgeneralization
"She rejected me, so nobody wants me, because I feel so unlovable right now.",Overgeneralization,Emotional Reasoning
I am exhausted after dealing with that difficult client all day.,No Distortion,
"My day was good, but I hit traffic, so today was a total waste.",Mental Filter,All-or-Nothing Thinking
"If the meal isn't gourmet, it's inedible garbage, because that one burnt edge ruins it.",All-or-Nothing Thinking,Mental Filter
"I fixed the sink, but it was an easy fix, so I'm not really handy.",Disqualifying the Positive,
"I saved money, but not enough, so I'm poor, and I'll end up homeless.",Disqualifying the Positive,Jumping to Conclusions
"I saved money, but not enough, so I'm poor, and my savings are a joke.",Disqualifying the Positive,Magnification or Minimization
I am weak.,Labeling,
"I got a C; I'll never graduate, and I'm wasting my parents' tuition money.",Magnification or Minimization,Personalization
"I tripped; everyone hates me, because I feel so mortified.",Magnification or Minimization,Emotional Reasoning
"I fixed the door, but it's still squeaky.",Disqualifying the Positive,
"I fixed the sink, but it was an easy fix.",Disqualifying the Positive,
"I feel angry, so you are unfair, and your apology is fake.",Emotional Reasoning,Disqualifying the Positive
I'll never own a home.,Jumping to Conclusions,
"Every time I wash my car, it rains.",Overgeneralization,
"I didn't finish the entire checklist, so I had a completely unproductive day.",All-or-Nothing Thinking,
"I am a slob, so I'll never have a nice home.",Labeling,Jumping to Conclusions
"I feel rejected, so I am worthless.",Emotional Reasoning,
"I got a bonus, but they taxed it heavily, so it's practically nothing.",Mental Filter,
"I lost $5; I'm going bankrupt, and I'm destroying my family's future.",Magnification or Minimization,Personalization
"The party was fun, but I felt awkward, so I humiliated myself, and they won't invite me back.",Mental Filter,Jumping to Conclusions
I never get a break.,Overgeneralization,
I should not feel sad.,Should Statements,
"I feel a pain; it's definitely cancer, and I always have the worst luck with health.",Jumping to Conclusions,Overgeneralization
"I gained a pound; I'm obese, and I'm ignoring my overall health.",Magnification or Minimization,Mental Filter
"I am a slob, because of this one pile, ignoring the clean room.",Labeling,Mental Filter
I'm feeling really weary after dealing with insurance claims all day.,No Distortion,
"I passed the test, but I missed the last question, so I'm stupid.",Mental Filter,
My husband is sad; I upset him.,Personalization,
"The boss called me in, so I'm fired, and I'll be homeless by next week.",Jumping to Conclusions,Magnification or Minimization
I am a failure.,Labeling,
I have a bruise; I'm battered.,Magnification or Minimization,
Men never listen to me.,Overgeneralization,
She didn't smile at me; people are always rude to me.,Overgeneralization,
"I feel a bit envious of her promotion, but I know she worked hard.",No Distortion,
"I feel ashamed, so I am worthless.",Emotional Reasoning,
I feel hesitant to trust him again after what happened last time.,No Distortion,
"They clapped, but they pitied me, and I made them feel awkward.",Disqualifying the Positive,Personalization
"The project failed; I take full responsibility, and I should have worked harder.",Personalization,Should Statements
I feel uneasy about the dark clouds gathering on the horizon.,No Distortion,
"I feel ugly, so I am hideous and no one will look at me.",Emotional Reasoning,All-or-Nothing Thinking
The boss is frowning; he's going to demote me.,Jumping to Conclusions,
I got a B; I'm failing at life.,Magnification or Minimization,
I always drop my toast butter-side down.,Overgeneralization,
"I feel hopeless, so I am doomed.",Emotional Reasoning,
I ought to call my mother more.,Should Statements,
"He hasn't called, so he hates me, because I feel so anxious waiting for him.",Jumping to Conclusions,Emotional Reasoning
I spilled ink on the page; the whole notebook is ruined.,Magnification or Minimization,
"I saved money, but not enough, so I'm poor, and I ought to save more.",Disqualifying the Positive,Should Statements
"All men are liars, and I must attract deceitful people.",Overgeneralization,Personalization
"She said I'm smart, but she's just being nice, and people always lie to make me feel better.",Disqualifying the Positive,Overgeneralization
"I am a bad mother, and I'm the reason my kids are acting out.",Labeling,Personalization
I am weak.,Labeling,
I am fuming that they charged me for a service I cancelled.,No Distortion,
"I should be perfect, and since I'm not, I'm disappointing everyone.",Should Statements,Personalization
"I feel bored, so life is dull, and the fun trip last week doesn't count.",Emotional Reasoning,Disqualifying the Positive
"I see a scratch, so the car is junk, and I'm careless.",Mental Filter,Labeling
"The trip was fun, but the flight was long, so it was miserable.",Mental Filter,
"She's looking away, so she's bored, and I'm a bore.",Jumping to Conclusions,Labeling
I'll never find a partner.,Jumping to Conclusions,
"I got a promotion, but my office is smaller, so I hate the new job.",Mental Filter,
"I got the scholarship, but they had low standards this year.",Disqualifying the Positive,
The deal fell through; I must have said something wrong.,Personalization,
It's total victory or absolute defeat.,All-or-Nothing Thinking,
I am a pig.,Labeling,
It's exasperating when the bus drives past without stopping.,No Distortion,
"She said I'm smart, but she's just being nice, so I'm actually dumb.",Disqualifying the Positive,Labeling
"If I don't get this promotion, I'm a failure, and I should have worked harder.",All-or-Nothing Thinking,Should Statements
I'm anxious about the presentation tomorrow because public speaking scares me.,No Distortion,
Waiting for this email is torture.,Magnification or Minimization,
I should have saved more money.,Should Statements,
"I should not be sad, and my tears make me weak, so I must stop crying.",Should Statements,Labeling
"I am a loser, because I lost the game, and I'm fixated on the score.",Labeling,Mental Filter
I should have saved.,Should Statements,
"I passed the test, but I missed one point, so I'm stupid, and I disappointed my parents.",Mental Filter,Personalization
My stomach hurts; it's appendicitis.,Jumping to Conclusions,
Everyone always ignores my texts.,Overgeneralization,
I made a typo; I am completely unprofessional.,Magnification or Minimization,All-or-Nothing Thinking
"I look okay, but I have a pimple, so I'm ugly, and I look like a monster.",Mental Filter,Magnification or Minimization
"Every time I wear white, I spill coffee on myself.",Overgeneralization,
"The team lost; I played badly, because I feel like I let everyone down.",Personalization,Emotional Reasoning
I got a C; I'm a dropout.,Magnification or Minimization,
"I won't get the loan, so why try, I'm completely financially ruined.",Jumping to Conclusions,Magnification or Minimization
"I have a headache; it's a tumor, and I should have gone to the doctor sooner.",Jumping to Conclusions,Should Statements
I have a pimple on my chin; I look like a monster.,Magnification or Minimization,
I am a loser.,Labeling,
"I got the job, but they were desperate, and I should have earned it.",Disqualifying the Positive,Should Statements
"I got the promotion, but they were desperate to fill the role.",Disqualifying the Positive,
I must always be kind.,Should Statements,
I am incensed that they towed my car without warning.,No Distortion,
I always choose the wrong queue at the store.,Overgeneralization,
I just know I'm going to have a panic attack at the party.,Jumping to Conclusions,
"I see a scratch, so the car is junk, and the engine is probably going to explode soon.",Mental Filter,Jumping to Conclusions
I feel wary of these new diet pills my friend is taking.,No Distortion,
I must never be weak.,Should Statements,
I must always be available.,Should Statements,
"I should not be sad; if I'm sad, I'm weak.",Should Statements,All-or-Nothing Thinking
Nobody ever invites me anywhere.,Overgeneralization,
"I was late; I've destroyed my reputation, focusing only on the clock.",Magnification or Minimization,Mental Filter
"I feel lonely, so I am unlovable.",Emotional Reasoning,
"My husband is sad; I upset him, because I feel so bad seeing him down.",Personalization,Emotional Reasoning
"I feel stupid, so I am an idiot, and my degree doesn't prove anything.",Emotional Reasoning,Disqualifying the Positive
"They didn't invite me, so they are not my friends anymore.",Jumping to Conclusions,All-or-Nothing Thinking
I gained two pounds; I am fat and disgusting.,Magnification or Minimization,All-or-Nothing Thinking
"I feel hopeless, so there is no future.",Emotional Reasoning,
People should drive better.,Should Statements,
"I got an A on the exam, but I missed one point, so I'm stupid, and I'll never be perfect.",Mental Filter,Overgeneralization
I should not be angry.,Should Statements,
"I feel bored, so life is dull, and I'm ignoring the fun I had earlier.",Emotional Reasoning,Mental Filter
"She's crying; I hurt her, and I'm a monster.",Personalization,Magnification or Minimization
"I got a ticket, so I'm always in trouble, focusing only on the police interaction.",Overgeneralization,Mental Filter
"If I'm not the best, I'm the worst, and I'm a complete incompetence.",All-or-Nothing Thinking,Labeling
"I should have known, and my ignorance is inexcusable.",Should Statements,Magnification or Minimization
"I burned the toast, so I ruin every meal, and I'm a terrible cook.",Overgeneralization,Labeling
"He frowned, so he's angry, and I'm a bad partner.",Jumping to Conclusions,Labeling
"I got a huge bonus, but they taxed it, so it's pointless.",Mental Filter,
"The dinner was a disaster because the bread was stale, and it was the worst night of my life.",All-or-Nothing Thinking,Magnification or Minimization
I feel uneasy walking home alone in the dark.,No Distortion,
"The project failed; I take full responsibility, because I feel so incompetent.",Personalization,Emotional Reasoning
It's perfection or nothing.,All-or-Nothing Thinking,
All lawyers are sharks.,Overgeneralization,
I am a jerk.,Labeling,
"She's looking away, so she's bored, and it's because I'm not interesting enough.",Jumping to Conclusions,Personalization
"My partner is great, but he forgot the milk, so he's useless, and his apology doesn't mean anything.",Mental Filter,Disqualifying the Positive
"I didn't finish the list, so I'm lazy, and this unproductivity is a crisis.",All-or-Nothing Thinking,Magnification or Minimization
"I feel ugly, so I am hideous, and I'm fixated on my insecurities.",Emotional Reasoning,Mental Filter
"They clapped, but they pitied me, so I'm pathetic.",Disqualifying the Positive,Labeling
"The dinner was a disaster because the rice was dry, and I've ruined everyone's night.",All-or-Nothing Thinking,Personalization
"I love my job, but I hate one coworker, so I have to quit immediately.",Mental Filter,All-or-Nothing Thinking
I ate a candy bar; my diet is completely shot.,All-or-Nothing Thinking,
"People should be on time, and since they aren't, I'm a doormat.",Should Statements,Labeling
"He looks bored; I'm boring him, and I'm dull.",Personalization,Labeling
"I spilled water; the floor is ruined, and cleaning it up won't fix the damage.",Magnification or Minimization,Disqualifying the Positive
"I ought to be rich, and since I'm not, I'm failing my family.",Should Statements,Personalization
I am a bad mother.,Labeling,
I am a mess.,Labeling,
"He looks bored; I'm boring him, and him being tired doesn't count.",Personalization,Disqualifying the Positive
"I fixed the sink, but I needed a manual, so I'm incompetent, and it's going to leak again tomorrow.",Disqualifying the Positive,Jumping to Conclusions
"The feedback was good, but they noted a typo, so I failed, and I let the team down.",Mental Filter,Personalization
She's crying; I said something wrong so I am a monster.,Personalization,All-or-Nothing Thinking
"He was rude, so everyone is mean, and I'm a victim.",Overgeneralization,Labeling
It’s just a Nobel Prize; it doesn't mean I'm smart.,Magnification or Minimization,
"This line is torture, and I chose the wrong time to come.",Magnification or Minimization,Personalization
"He looks bored; I'm boring him, and he's going to end the date early.",Personalization,Jumping to Conclusions
"She said I'm nice, but she has to say that.",Disqualifying the Positive,
I am weak.,Labeling,
"The dinner was tasty, but the service was slow, so I hated it, and the waiter did it on purpose.",Mental Filter,Jumping to Conclusions
"The vacation was perfect, but the flight home was delayed, so it was a nightmare.",Mental Filter,
"I lost my keys, so I always lose everything, and I'm ignoring the years I kept them safe.",Overgeneralization,Mental Filter
"She said I'm smart, but she's just being nice, and I'm actually an idiot.",Disqualifying the Positive,Labeling
"If I'm not thin, I'm fat.",All-or-Nothing Thinking,
"I feel bored, so this class is pointless.",Emotional Reasoning,
My day was going well until I broke a nail; now the day is ruined.,Mental Filter,
You're either with me 100% or you're against me.,All-or-Nothing Thinking,
I am a bad friend.,Labeling,
It rained on the trip; I ruined the vacation.,Personalization,
"My partner is great, but he forgot the milk, so he doesn't care, and he's probably seeing someone else.",Mental Filter,Jumping to Conclusions
I feel self-conscious about my new haircut.,No Distortion,
"I feel guilty, so I must be bad.",Emotional Reasoning,
My wife is quiet; I annoyed her.,Personalization,
"Every time I try to help, I make things worse.",Overgeneralization,
I should always be productive.,Should Statements,
I'm swamped with chores and don't know where to start.,No Distortion,
"I have a headache; it's a tumor, and I'm weak for being scared.",Jumping to Conclusions,Labeling
I burned the toast; I ruin everything in the kitchen.,Overgeneralization,
"I feel stupid, so I am an idiot, and I'll fail the exam.",Emotional Reasoning,Jumping to Conclusions
I should have saved more money.,Should Statements,
"I tripped; everyone hates me, and I made a fool of myself.",Magnification or Minimization,Personalization
"I spilled water; the floor is ruined, and this is a catastrophe.",Magnification or Minimization,Jumping to Conclusions
Nobody ever invites me to lunch.,Overgeneralization,
I must please everyone I meet.,Should Statements,
"I tripped; everyone hates me, and I'm a clumsy fool.",Magnification or Minimization,Labeling
"I didn't win gold, so I'm a loser, because I feel so disappointed in myself.",Magnification or Minimization,Emotional Reasoning
"We had a nice walk, but it rained at the end, so the day was awful.",Mental Filter,
I forgot to lock the door; I am completely irresponsible.,Magnification or Minimization,
"It rained on my wedding; I jinxed it, and I'm ignoring the happy ceremony.",Personalization,Mental Filter
"I should be thinner, and since I'm not, I'm a whale.",Should Statements,Labeling
"I feel bored, so life is dull, and this boredom is killing me.",Emotional Reasoning,Magnification or Minimization
"I saved $20, but that's nothing.",Disqualifying the Positive,
"If the house isn't spotless, it's a pigsty, and I should keep it clean.",All-or-Nothing Thinking,Should Statements
"She said 'I'll try', which means 'no'.",Jumping to Conclusions,
I am a fake.,Labeling,
I gained an ounce; I'm a whale.,Magnification or Minimization,
My wife is sad; I hurt her.,Personalization,
"Unless I get straight As, I am an academic failure.",All-or-Nothing Thinking,
My son failed; I'm a bad dad.,Personalization,
"It rained today, so it always rains on my days off, and the weather should be nice.",Overgeneralization,Should Statements
I am a burden.,Labeling,
"I got a ticket, so I'm always in trouble, and I'm going to rot in jail.",Overgeneralization,Magnification or Minimization
"I lost my wallet, so I always lose everything, and I'm an irresponsible idiot.",Overgeneralization,Labeling
He didn't wave back; he is mad at me.,Jumping to Conclusions,
"I stumbled, so I am always clumsy, and I'm an oaf.",Overgeneralization,Labeling
"I feel anxious, so there must be a threat nearby.",Emotional Reasoning,
"I feel angry, so you must have treated me unfairly.",Emotional Reasoning,
It rained on the picnic; I chose the wrong day.,Personalization,
"I am a loser, and I'm dragging my team down.",Labeling,Personalization
"I'm either a genius or an idiot, and my mistake embarrassed the whole department.",All-or-Nothing Thinking,Personalization
"She said 'maybe', which definitely means 'no'.",Jumping to Conclusions,
"I completed the puzzle, but it was for kids.",Disqualifying the Positive,
"I finished the puzzle, but it was an easy one.",Disqualifying the Positive,
"I feel overwhelmed, so the task is impossible and I should give up.",Emotional Reasoning,All-or-Nothing Thinking
"I finished the task, but it was easy, so it doesn't count, and I'm ignoring the effort it took.",Disqualifying the Positive,Mental Filter
My husband is tired; I work him too hard.,Personalization,
"The store is closed; I caused this, and I'm irresponsible.",Personalization,Labeling
I burned the rice; I can't cook anything right.,Overgeneralization,
Everyone is always rude to me.,Overgeneralization,
I am drained from working a double shift.,No Distortion,
All politicians are corrupt.,Overgeneralization,
It's total victory or absolute defeat.,All-or-Nothing Thinking,
"The painting isn't perfect, so I might as well throw it in the trash.",All-or-Nothing Thinking,
"I see one weed in the garden, so the whole yard looks neglected.",Mental Filter,
I must never disappoint anyone.,Should Statements,
I am grieving the end of my favorite TV show; it feels like losing a friend.,No Distortion,
"My performance was trash because I stuttered, and I humiliated my coach.",All-or-Nothing Thinking,Personalization
"I should be perfect, and since I'm not, I'm a failure.",Should Statements,Labeling
"We had a nice walk, but it was humid, so it was miserable, and I'm going to get heatstroke.",Mental Filter,Jumping to Conclusions
"My vacation was perfect, except for the flight delay, which ruined everything.",Mental Filter,
"She's whispering, so she's gossiping about me, and everyone always talks behind my back.",Jumping to Conclusions,Overgeneralization
I am a chicken.,Labeling,
I got a C; my GPA is destroyed and I'll never get a job.,Magnification or Minimization,All-or-Nothing Thinking
I am weak.,Labeling,
"I am a slob, and my house is a disaster zone.",Labeling,Magnification or Minimization
My son failed; I'm a bad dad.,Personalization,
The dinner burned; I ruin everything I touch.,Personalization,
"They laughed, but they laugh at everything.",Disqualifying the Positive,
I feel secluded working the night shift while everyone sleeps.,No Distortion,
"Unless I'm perfect, I'm nothing.",All-or-Nothing Thinking,
"The boss called me in, so I'm fired, and I've let down my team.",Jumping to Conclusions,Personalization
"It rained today, so it always rains on my days off, and my weekend is ruined before it starts.",Overgeneralization,Jumping to Conclusions
I am a mess.,Labeling,
"They clapped, but they pitied me, and I'm ignoring their smiles.",Disqualifying the Positive,Mental Filter
"The dinner burned; I ruin everything, and I ought to pay attention.",Personalization,Should Statements
"I see a blemish on my face, so I look completely hideous.",Mental Filter,All-or-Nothing Thinking
My day was productive until I spilt water; now the day is a waste.,Mental Filter,
"Unless everyone likes me, I'm worthless, and I'm a social pariah.",All-or-Nothing Thinking,Labeling
"I feel anxious, so the situation is completely dangerous.",Emotional Reasoning,All-or-Nothing Thinking
I'm feeling really demoralized because the project funding was cut.,No Distortion,
My son failed his test; it's my fault for not tutoring him.,Personalization,
"I should have known better, but I didn't, and I'm always naive.",Should Statements,Overgeneralization
"I got the job, but they were desperate, so I'm unhireable, and this job means nothing.",Disqualifying the Positive,Magnification or Minimization
I'm stressed about the upcoming exams; there is so much to study.,No Distortion,
My daughter cried; I'm a bad father.,Personalization,
I'm buried under a mountain of laundry and chores.,No Distortion,
"If I'm not the best, I'm the worst, because I feel like such a loser compared to them.",All-or-Nothing Thinking,Emotional Reasoning
I'll never get out of debt.,Jumping to Conclusions,
"If I go, nobody will talk to me, because I feel so invisible.",Jumping to Conclusions,Emotional Reasoning
"I fixed the car, but it was an easy fix.",Disqualifying the Positive,
All salespeople are scammers.,Overgeneralization,
I feel isolated living alone during the holidays.,No Distortion,
I should have studied harder.,Should Statements,
"I feel angry, so you are abusive.",Emotional Reasoning,
"The project has a flaw, so the whole thing is garbage.",All-or-Nothing Thinking,
"I should be perfect, or else I am a failure.",Should Statements,All-or-Nothing Thinking
"The store is closed; I caused this, and it's a tragedy.",Personalization,Magnification or Minimization
"I feel lonely, so nobody loves me, and my isolation is total.",Emotional Reasoning,Magnification or Minimization
"She said 'maybe', which means 'no'.",Jumping to Conclusions,
All mechanics are crooks.,Overgeneralization,
I am a bad father.,Labeling,
"If I don't get the gold medal, I'm a complete failure.",All-or-Nothing Thinking,
"Unless everyone likes me, I'm worthless, and they're probably all laughing at me right now.",All-or-Nothing Thinking,Jumping to Conclusions
My day was perfect until I spilt tea; now the whole day is wasted.,Mental Filter,
I am spent after that intense workout session.,No Distortion,
"I finished the project, but it was easy, so my contribution means nothing.",Disqualifying the Positive,All-or-Nothing Thinking
The boss is quiet; he's going to fire me.,Jumping to Conclusions,
"Unless everyone loves the idea, it's garbage, because nobody ever likes what I do.",All-or-Nothing Thinking,Overgeneralization
"I won the award, but it was just dumb luck.",Disqualifying the Positive,
"I feel ashamed, so I have done something shameful.",Emotional Reasoning,
"I look okay, but I have a pimple, so I'm ugly, and my skin should be clear.",Mental Filter,Should Statements
I burned the garlic; I ruin every meal.,Overgeneralization,
"It rained on my wedding; I jinxed it, and I'm a curse.",Personalization,Labeling
I feel insecure about my accent when I speak in public.,No Distortion,
"He was rude, so everyone in this city is mean, and I'm ignoring the nice lady who held the door.",Overgeneralization,Mental Filter
"She said I'm smart, but she's just being nice, and she secretly thinks I'm incompetent.",Disqualifying the Positive,Jumping to Conclusions
I am a jerk.,Labeling,
I am a burden.,Labeling,
"I got the job, but they were desperate, and I'm unqualified.",Disqualifying the Positive,Labeling
"My kids are healthy, but my son got a C, so I'm a bad mom.",Mental Filter,
"She's crying; I said something wrong, and I always hurt people's feelings.",Personalization,Overgeneralization
"I have a headache; it's a tumor, and I'm ignoring that I'm dehydrated.",Jumping to Conclusions,Mental Filter
"I feel guilty, so I am guilty.",Emotional Reasoning,
"I am a loser, and I never win at anything in life.",Labeling,Overgeneralization
"The party was fun, but the food was cold, so it sucked.",Mental Filter,
"I fixed the sink, but I needed a manual, so I'm incompetent, and I should know how to fix things.",Disqualifying the Positive,Should Statements
I'm feeling really disheartened about the election results.,No Distortion,
"I have a pimple; I look like a monster, because I feel so disgusting.",Magnification or Minimization,Emotional Reasoning
"I ought to be rich, and being comfortable doesn't count as success.",Should Statements,Disqualifying the Positive
I am a failure.,Labeling,
I ought to have a degree by now.,Should Statements,
The power went out; I used too much energy.,Personalization,
I feel uneasy about the political situation in the news.,No Distortion,
"I was late; I've destroyed my reputation, because I feel so ashamed.",Magnification or Minimization,Emotional Reasoning
I failed one quiz; I'll never pass a test again.,Overgeneralization,
"I feel angry, so you are a villain.",Emotional Reasoning,
I feel apprehensive about the changes happening at my company.,No Distortion,
"I'm either a genius or an idiot, and since I made a mistake, everyone knows I'm a fraud.",All-or-Nothing Thinking,Jumping to Conclusions
