text,dominant_distortion,secondary_distortion
"I feel hopeless, so my future is black, and nothing will ever get better.",Emotional Reasoning,Overgeneralization
I'm stressed about how I'm going to pay off this credit card debt.,No Distortion,
"I love my new house, but the faucet leaks, so it's a dump, and nothing I buy ever works.",Mental Filter,Overgeneralization
"I am a coward, and doing that brave thing once doesn't make me brave.",Labeling,Disqualifying the Positive
I'll never find a partner who understands me.,Jumping to Conclusions,
"If I ask him out, he'll reject me and I'll be humiliated forever.",Jumping to Conclusions,All-or-Nothing Thinking
"The review was great, but they noted a typo, so I failed.",Mental Filter,
"I am an idiot, and I'm embarrassing my teachers.",Labeling,Personalization
"I must please everyone, and if I don't, I'm selfish.",Should Statements,Labeling
"He hasn't called, so he hates me, and I must have said something stupid.",Jumping to Conclusions,Personalization
"He loves me, but he doesn't know the real me, and I'm tricking him.",Disqualifying the Positive,Personalization
"I fixed the sink, but I needed a manual, so I'm not handy, and I can never fix anything alone.",Disqualifying the Positive,Overgeneralization
"I didn't finish the last item, so the day was a waste, and I'm ignoring the ten things I did finish.",All-or-Nothing Thinking,Mental Filter
I forgot the name; I'm senile.,Magnification or Minimization,
I feel cynical about the promises made by the new management.,No Distortion,
"I'm either a genius or an idiot, and I feel so stupid today, so I must be an idiot.",All-or-Nothing Thinking,Emotional Reasoning
"I feel confused, so I am stupid.",Emotional Reasoning,
"This line is torture, and I'm focusing entirely on the wait time.",Magnification or Minimization,Mental Filter
I always pick the slowest line at the store.,Overgeneralization,
"The concert was amazing, but the line was long, so I hated it.",Mental Filter,
"I am a toxic person, because I had one fight, and I'm obsessing over it.",Labeling,Mental Filter
"I feel rejected, so I'm an outcast, and society will never accept me.",Emotional Reasoning,Jumping to Conclusions
"I made a typo; I'm unprofessional, and I'm ignoring the rest of the report.",Magnification or Minimization,Mental Filter
"I got a ticket, so I'm always in trouble, and I'm a criminal.",Overgeneralization,Labeling
"I feel lonely, so nobody loves me, and I'll die alone.",Emotional Reasoning,Jumping to Conclusions
I must please everyone.,Should Statements,
"The dinner was tasty, but the service was slow, so I hated it, and waiting was pure torture.",Mental Filter,Magnification or Minimization
"I passed the exam, but I guessed on one, so I don't deserve it.",Mental Filter,
"The team lost; I played badly, and I ought to have practiced more.",Personalization,Should Statements
"They cheered, but they cheer for everyone.",Disqualifying the Positive,
"I am a bad mother, so my kids will grow up to hate me.",Labeling,Jumping to Conclusions
"They clapped, but they were just being polite.",Disqualifying the Positive,
"I failed the quiz, so I'll never learn, because I feel so hopeless about math.",Overgeneralization,Emotional Reasoning
I have a pimple; I look like a monster.,Magnification or Minimization,
People should respect their elders.,Should Statements,
"I look good, but it's just the angle.",Disqualifying the Positive,
I am grieving the loss of my normalcy after the accident.,No Distortion,
"The project failed; I take full responsibility, and the boss will blame me entirely.",Personalization,Jumping to Conclusions
"I passed the test, but I missed one point, so I'm stupid, and I'm a failure.",Mental Filter,Labeling
"The feedback was good, but they noted a typo, so they think I'm illiterate.",Mental Filter,Jumping to Conclusions
"I passed the test, but I missed one point, so I'm stupid, and this is a huge embarrassment.",Mental Filter,Magnification or Minimization
I always pick the broken shopping cart.,Overgeneralization,
My diet is destroyed because I ate a slice of pizza.,All-or-Nothing Thinking,
"I didn't win gold, so I'm a loser, and the silver medal is just a consolation prize.",Magnification or Minimization,Disqualifying the Positive
"All men are liars, because I feel so betrayed and suspicious of everyone.",Overgeneralization,Emotional Reasoning
He hasn't texted back in an hour; he must be cheating on me.,Jumping to Conclusions,
"I am a loser, so everyone laughs at me, and they always will.",Labeling,Overgeneralization
"She rejected me, so nobody wants me, because I am fundamentally unlovable.",Overgeneralization,Personalization
They are whispering; they are talking about my hair.,Jumping to Conclusions,
You're either my best friend or a complete stranger.,All-or-Nothing Thinking,
I am concerned that my savings account isn't growing fast enough.,No Distortion,
This rain is the end of the world.,Magnification or Minimization,
"I feel hopeless, so it's over, and things ought to be different.",Emotional Reasoning,Should Statements
"The boss called me in, so I'm fired, and I'm a failure.",Jumping to Conclusions,Labeling
"I am a loser, so everyone is laughing at me behind my back.",Labeling,Jumping to Conclusions
"My drawing was picked, but the judge has bad taste.",Disqualifying the Positive,
"They are laughing; it's about me, and them waving at me is just a distraction.",Jumping to Conclusions,Disqualifying the Positive
My throat hurts; it's definitely throat cancer.,Jumping to Conclusions,
"If I can't fix this car, I'm useless, and I'll never be good with my hands.",All-or-Nothing Thinking,Overgeneralization
"If I wear this hat, everyone will laugh.",Jumping to Conclusions,
He looks bored; I am boring him.,Personalization,
"It rained on my wedding; I jinxed it, because I feel so responsible for the weather.",Personalization,Emotional Reasoning
"All men are liars, and I'm a magnet for jerks.",Overgeneralization,Labeling
"She rejected me, so nobody wants me, and I'm destined to die alone.",Overgeneralization,Jumping to Conclusions
"She's crying; I hurt her, and the sad movie she's watching doesn't count.",Personalization,Disqualifying the Positive
"The world should be fair, and since it's not, everything is awful.",Should Statements,All-or-Nothing Thinking
It’s just a marathon; lots of people run them.,Magnification or Minimization,
"I didn't get the top award, so my achievement is meaningless.",Magnification or Minimization,All-or-Nothing Thinking
"I look fit, but my calves are small, so I look weak.",Mental Filter,
"They hired someone else, so I never get picked, and I'm a loser.",Overgeneralization,Labeling
"We had a nice walk, but it was humid, so it was miserable, and I chose the wrong time to go.",Mental Filter,Personalization
"I'm nervous about the upcoming surgery, which is a normal reaction.",No Distortion,
I am a loser.,Labeling,
"I feel ugly, so I am hideous, and I'm a troll.",Emotional Reasoning,Labeling
"I feel lonely, so no one cares about me.",Emotional Reasoning,
"The party was fun, but I felt awkward, so the night was ruined, and it was a massive humiliation.",Mental Filter,Magnification or Minimization
"I didn't finish the book, so reading it was a waste of time.",All-or-Nothing Thinking,
"My son failed; it's my fault, and his lack of studying is irrelevant.",Personalization,Disqualifying the Positive
"He hasn't called, so he hates me, and this silence is killing me.",Jumping to Conclusions,Magnification or Minimization
"I must please everyone, and if I say no, they will hate me.",Should Statements,Jumping to Conclusions
"I burned the toast, so I ruin every meal, and I'm starving my family.",Overgeneralization,Personalization
"I spilled water; the floor is ruined, and I should be more careful.",Magnification or Minimization,Should Statements
My diet is ruined because I ate one french fry.,All-or-Nothing Thinking,
All politicians are crooks.,Overgeneralization,
It’s just a Pulitzer; it doesn't mean I can write.,Magnification or Minimization,
"I should not be sad, and crying makes me pathetic.",Should Statements,Magnification or Minimization
I should not be sad.,Should Statements,
I feel self-conscious about speaking up in meetings.,No Distortion,
The boss wants to see me; I'm definitely getting fired.,Jumping to Conclusions,
"I feel guilty, so I am bad, and I am the cause of all this trouble.",Emotional Reasoning,Personalization
"My husband is sad; I upset him, and he's thinking about leaving me.",Personalization,Jumping to Conclusions
"I passed the bar, but my score wasn't top tier, so I'm barely a lawyer.",Mental Filter,
"If I don't get straight As, I'm a dropout, and I can't stop thinking about that B minus.",All-or-Nothing Thinking,Mental Filter
"If I'm not thin, I'm fat and ugly.",All-or-Nothing Thinking,
He looks bored; I'm uninteresting.,Personalization,
She's looking at the door; she wants to leave.,Jumping to Conclusions,
"I tripped; everyone hates me, and this video will go viral.",Magnification or Minimization,Jumping to Conclusions
I feel insecure when I have to meet new people at parties.,No Distortion,
I got a B+; I'm failing school.,Magnification or Minimization,
I lost $20; I’m going to go bankrupt.,Magnification or Minimization,
"I didn't win gold, so I'm a loser, and I'm minimizing the silver medal.",Magnification or Minimization,Mental Filter
I should have known the answer.,Should Statements,
"I feel tired, so I am lazy.",Emotional Reasoning,
"I was late; I've destroyed my reputation, and they'll never trust me again.",Magnification or Minimization,Jumping to Conclusions
This stain is a catastrophe.,Magnification or Minimization,
Waiting for this email is sheer agony.,Magnification or Minimization,
"We had a nice walk, but it was humid, so it was miserable, and I'm a sweat-hog.",Mental Filter,Labeling
"I feel rejected, so I am unworthy.",Emotional Reasoning,
I am a bad influence.,Labeling,
I should not be tired.,Should Statements,
It's my way or the highway.,All-or-Nothing Thinking,
"I feel anxious, so there is danger, and I should be careful.",Emotional Reasoning,Should Statements
"I finished the project, but anyone could have done it.",Disqualifying the Positive,
"I tripped; everyone hates me, and I'm magnifying the embarrassment.",Magnification or Minimization,Mental Filter
"If I go, nobody will talk to me, and my friends inviting me are just doing it out of pity.",Jumping to Conclusions,Disqualifying the Positive
He didn't text back; people are so unreliable.,Overgeneralization,
I should have known better.,Should Statements,
I should always be strong.,Should Statements,
"The store is closed; I caused this, and now I won't be able to buy dinner.",Personalization,Jumping to Conclusions
"I am weak, so I can't handle any stress.",Labeling,All-or-Nothing Thinking
I failed one interview; I'll never get hired.,Overgeneralization,
The project failed; I take full responsibility for everything.,Personalization,
I am a slob.,Labeling,
"I got the grant, but they had extra money to burn.",Disqualifying the Positive,
"Unless everyone likes me, I'm worthless, because I feel so rejected when one person frowns.",All-or-Nothing Thinking,Emotional Reasoning
"My song was streamed, but only by my friends.",Disqualifying the Positive,
It rained on my wedding; I jinxed it and the marriage is doomed.,Personalization,All-or-Nothing Thinking
"I feel angry, so you are evil.",Emotional Reasoning,
"I fixed the leak, but a real plumber would have done it faster.",Disqualifying the Positive,
"I have a pimple; I look like a monster, and nobody will want to date me.",Magnification or Minimization,Jumping to Conclusions
"Unless I'm perfect, I'm worthless.",All-or-Nothing Thinking,
"I fixed the sink, but I needed a manual, so I'm incompetent, and I'm a burden to my wife.",Disqualifying the Positive,Personalization
I must always be polite.,Should Statements,
"My partner is great, but he forgot the milk, so he's useless, and this negligence is unforgivable.",Mental Filter,Magnification or Minimization
He didn't hold the door; chivalry is dead.,Overgeneralization,
"It rained today, so the weather is always bad for me, and I'm cursed.",Overgeneralization,Labeling
I am a fraud.,Labeling,
"If I'm not perfect, I'm worthless.",All-or-Nothing Thinking,
"I feel angry, so you are my enemy.",Emotional Reasoning,All-or-Nothing Thinking
"I have a headache; it's a tumor, because I feel so scared of dying.",Jumping to Conclusions,Emotional Reasoning
"They laughed at my joke, but they were just being polite.",Disqualifying the Positive,
"The report has an error, so it's complete garbage.",All-or-Nothing Thinking,
Everyone always talks over me in meetings.,Overgeneralization,
"If I don't get this promotion, I'm a total failure, and I'm a loser.",All-or-Nothing Thinking,Labeling
"I should not be sad, and the fact that I have reason to grieve is irrelevant.",Should Statements,Disqualifying the Positive
I am weak.,Labeling,
"I feel angry, so you are wrong.",Emotional Reasoning,
"The soup was delicious, but it was slightly too salty, so I hated the meal.",Mental Filter,
My husband is quiet; I bored him.,Personalization,
"She's crying; I hurt her, because I feel so mean.",Personalization,Emotional Reasoning
"He hasn't called, so he hates me, and I'm stupid for thinking he liked me.",Jumping to Conclusions,Labeling
The doctor is quiet; it's definitely terminal.,Jumping to Conclusions,
"I'm nervous about the results of my biopsy, hoping it's benign.",No Distortion,
I feel cautious about lending money to him again.,No Distortion,
"My performance was trash because I hesitated, and I feel so embarrassed it must have been awful.",All-or-Nothing Thinking,Emotional Reasoning
"I passed the test, but I missed one point, so I'm stupid, and I won't get into grad school.",Mental Filter,Jumping to Conclusions
"The boss called me in, so I'm fired, and I'm fixated on his stern face.",Jumping to Conclusions,Mental Filter
"She's crying; I hurt her, and I'm focused only on her tears.",Personalization,Mental Filter
I'm baffled as to why the computer keeps crashing.,No Distortion,
"If the house isn't spotless, it's a pigsty, and I'm making my family live in filth.",All-or-Nothing Thinking,Personalization
I feel frustrated that the contractor delayed the kitchen renovation again.,No Distortion,
I am a coward.,Labeling,
"I feel ashamed, so I am bad.",Emotional Reasoning,
"I got a raise, but taxes took some, so it's nothing, and I'm a pauper.",Mental Filter,Labeling
"I am a burden, because I feel heavy on my family's shoulders.",Labeling,Emotional Reasoning
I'm confused about where I stand in this relationship.,No Distortion,
I gained a pound; I'm a whale.,Magnification or Minimization,
"I gained a pound; I'm obese, and I'm letting myself go.",Magnification or Minimization,Personalization
I'm feeling really down today because I missed my best friend's birthday party due to work.,No Distortion,
I am a glutton.,Labeling,
I am a loser.,Labeling,
"She's crying; I hurt her, and she'll never forgive me.",Personalization,Jumping to Conclusions
"I saved money, but I spent $5 on coffee, so I'm broke, and I'll never be financially stable.",Mental Filter,Overgeneralization
"If I don't win, I'm a loser.",All-or-Nothing Thinking,
"I feel angry, so you are unfair, and I provoked you to treat me this way.",Emotional Reasoning,Personalization
"My partner is great, but he forgot our anniversary, so the relationship is dead.",Mental Filter,All-or-Nothing Thinking
Nothing good ever happens in this town.,Overgeneralization,
"She yawned, so I'm annoying her, and I'm a pest.",Jumping to Conclusions,Labeling
"I should not be sad, and my crying is burdening my friends.",Should Statements,Personalization
"I am a failure, so I will never succeed, and I'm doomed.",Labeling,All-or-Nothing Thinking
"I feel anxious, so the plane will crash.",Emotional Reasoning,
"I must please everyone, but one person is unhappy, so I failed.",Should Statements,Mental Filter
The dinner is cold; I am a terrible host.,Personalization,
The deal failed; I must have ruined it.,Personalization,
I am a slob.,Labeling,
I should have won that game.,Should Statements,
I failed this math quiz; I can't learn anything.,Overgeneralization,
I should always be perfect.,Should Statements,
"I got the job, but they were desperate, and they'll fire me within a week.",Disqualifying the Positive,Jumping to Conclusions
"The dinner burned; I ruin everything, and I can't look past the burnt pot.",Personalization,Mental Filter
"All men are liars, and this one lie is a massive betrayal.",Overgeneralization,Magnification or Minimization
I am sad that my favorite local bakery closed down.,No Distortion,
"I look fit, but my nose is big, so I'm ugly.",Mental Filter,
"I know I'll freeze on stage, because I'm only remembering my last failure.",Jumping to Conclusions,Mental Filter
It rained on the parade; I ruined it.,Personalization,
Nothing ever goes my way.,Overgeneralization,
"I feel guilty, so I must be a bad person.",Emotional Reasoning,
"The dinner was tasty, but the service was slow, so I hated it, and waiters should be faster.",Mental Filter,Should Statements
"My partner is great, but he forgot the milk, so he's useless, and I failed to remind him.",Mental Filter,Personalization
"The store is closed; I caused this, and I'm an idiot.",Personalization,Labeling
"I burned the toast, so I can't cook anything, and my family is going to starve.",Overgeneralization,Jumping to Conclusions
"He hugged me, but he probably felt obligated.",Disqualifying the Positive,
"If I don't get this job, I'm a total failure, and I'll never be able to pay my rent.",All-or-Nothing Thinking,Jumping to Conclusions
Either I'm beautiful or I'm ugly.,All-or-Nothing Thinking,
"I am a slob, and I make the house unlivable for my roommates.",Labeling,Personalization
I always get stuck in traffic.,Overgeneralization,
I regret not taking that job offer in London years ago.,No Distortion,
He looks bored; I'm boring.,Personalization,
"I tripped; everyone hates me, and I should watch my step.",Magnification or Minimization,Should Statements
"The store is closed; I caused this, and I'm fixated on my lateness.",Personalization,Mental Filter
"The party was fun, but I felt awkward for a second, so I humiliated myself.",Mental Filter,Jumping to Conclusions
I gained one pound; I’m obese.,Magnification or Minimization,
"I fixed the car, but I watched a video, so I'm still useless.",Disqualifying the Positive,All-or-Nothing Thinking
"I feel ugly, so I am hideous, and I'm an eyesore to others.",Emotional Reasoning,Personalization
I'm swamped with emails and don't know where to start.,No Distortion,
"I tripped; everyone hates me, and I'm a klutz.",Magnification or Minimization,Labeling
"I am a toxic person, and I ruin every gathering I attend.",Labeling,Personalization
"The book was thrilling, but the ending was vague, so I hated it.",Mental Filter,
"I look fit, but my arms are thin, so I look weak.",Mental Filter,
They are whispering; they are talking about me.,Jumping to Conclusions,
I never get a lucky break in life.,Overgeneralization,
"I spilled water; the floor is ruined, because I feel so overwhelmed by the mess.",Magnification or Minimization,Emotional Reasoning
"I missed one workout, so I'm a slob, and I should be more disciplined.",All-or-Nothing Thinking,Should Statements
"My parents divorced because of me, and I caused a massive family breakdown.",Personalization,Magnification or Minimization
I always catch every cold that goes around.,Overgeneralization,
"I feel lonely, so I am unlovable.",Emotional Reasoning,
I should have known.,Should Statements,
They are laughing; they are mocking me.,Jumping to Conclusions,
I am a jerk.,Labeling,
She's looking at her phone; she's bored of me.,Jumping to Conclusions,
I am a burden.,Labeling,
"I won't get the loan, so why try, because I feel so pessimistic about it.",Jumping to Conclusions,Emotional Reasoning
"You either love me or hate me, and since you argued with me, this is a catastrophe for our marriage.",All-or-Nothing Thinking,Magnification or Minimization
"It rained on my wedding; I jinxed it, and it's bad luck.",Personalization,Jumping to Conclusions
"They hired him, so I never get picked, and they should have realized my worth.",Overgeneralization,Should Statements
It's all or nothing with you.,All-or-Nothing Thinking,
"I won't get the loan, so why try, I'm a deadbeat.",Jumping to Conclusions,Labeling
"I didn't finish the last mile, so the run didn't count.",All-or-Nothing Thinking,
I gained an inch; I'm massive.,Magnification or Minimization,
"I feel rejected, so I am unwanted.",Emotional Reasoning,
I must never be late.,Should Statements,
I am furious that someone hit my parked car and drove off.,No Distortion,
"I feel envious of his talent, even though I know he worked hard for it.",No Distortion,
The bus is late; I jinxed it.,Personalization,
I failed one cooking attempt; I'll never be a good cook.,Overgeneralization,
"I feel guilty, so I must be bad, and my feelings are proof of my sins.",Emotional Reasoning,Jumping to Conclusions
"The store is closed; I caused this, and their holiday hours don't matter.",Personalization,Disqualifying the Positive
"I fixed the leak, but it was an easy fix, so it doesn't count.",Disqualifying the Positive,
"I feel anxious, so there is danger, and I'm about to die.",Emotional Reasoning,Magnification or Minimization
"The world should be fair, and the good things that happen are just anomalies.",Should Statements,Disqualifying the Positive
"The dinner burned; I ruin everything, and the oven being broken is no excuse.",Personalization,Disqualifying the Positive
"My husband is sad; I upset him, and I'm obsessing over my words.",Personalization,Mental Filter
I spilled ink; the rug is ruined forever.,Magnification or Minimization,
"I got a ticket, so I'm always in trouble, and the insurance company will cancel my policy.",Overgeneralization,Jumping to Conclusions
"They hired him, so I never get picked, and the interviews I passed before were for easy jobs.",Overgeneralization,Disqualifying the Positive
"I got a bonus, but taxes took some, so it's practically nothing.",Mental Filter,
Either I'm a success or a total flop.,All-or-Nothing Thinking,
I gained a pound; I'm huge.,Magnification or Minimization,
"She's looking away, so she's bored, and I should be more entertaining.",Jumping to Conclusions,Should Statements
"I feel rejected, so I'm an outcast, and being included yesterday was a mistake.",Emotional Reasoning,Disqualifying the Positive
He's sighing; he must be annoyed with me.,Jumping to Conclusions,
She's crying; I hurt her feelings.,Personalization,
I'm peeved that the barista got my order wrong again.,No Distortion,
"I feel a pang of envy when I see their vacation photos, even though I'm happy for them.",No Distortion,
I stumbled during the speech; the whole thing was a disaster.,All-or-Nothing Thinking,
"I got a C; I'll never graduate, and my parents will disown me.",Magnification or Minimization,Jumping to Conclusions
"I gained a pound; I'm obese, and I'll never be thin.",Magnification or Minimization,Overgeneralization
"I feel overwhelmed, so it's impossible, and the task is a mountain I can't climb.",Emotional Reasoning,Magnification or Minimization
"I feel ugly, so I look repulsive.",Emotional Reasoning,
"I feel rejected, so I am a total outcast.",Emotional Reasoning,All-or-Nothing Thinking
I feel mournful today thinking about my grandmother passing away.,No Distortion,
"I won the game, but it was just luck, so I'm still a loser.",Disqualifying the Positive,Labeling
"The world should be fair, but it's not, and justice never happens for me.",Should Statements,Overgeneralization
"I should be thinner, and since I'm not, I'm disgusting, and I must starve myself.",Should Statements,Labeling
"He bought me dinner, but he probably wants a favor.",Disqualifying the Positive,
"She said 'interesting', which means she hates it.",Jumping to Conclusions,
"I lost $5; I'm going bankrupt, and I'm fixated on the loss.",Magnification or Minimization,Mental Filter
"I feel guilty, so I am a criminal.",Emotional Reasoning,
It frustrates me when people interrupt me during meetings.,No Distortion,
All politicians are liars.,Overgeneralization,
I lost a cent; I'm broke.,Magnification or Minimization,
"I should be thinner, and my weight is a massive problem.",Should Statements,Magnification or Minimization
"The project failed; I take full responsibility, and the market crash is irrelevant.",Personalization,Disqualifying the Positive
The team lost; I played poorly.,Personalization,
"I passed the test, but I missed one point, so I'm stupid, and the high score was just because the test was easy.",Mental Filter,Disqualifying the Positive
I never get a lucky break.,Overgeneralization,
I feel cynical about the company's new mission statement.,No Distortion,
I ate a donut; I have zero self-control and I'm a glutton.,All-or-Nothing Thinking,Labeling
"She's looking away, so she's bored, because I feel so uninteresting.",Jumping to Conclusions,Emotional Reasoning
"Unless everyone applauds, the speech was a failure.",All-or-Nothing Thinking,
"I am a coward, so I'll never be brave, and it's hopeless.",Labeling,Emotional Reasoning
"I saved money, but not enough, so I'm poor.",Disqualifying the Positive,Labeling
"My son failed; it's my fault, and I'm a bad parent.",Personalization,Labeling
"The dinner burned; I ruin everything, because I feel so careless.",Personalization,Emotional Reasoning
"I feel anxious, so there is danger, and I'm making everyone else nervous too.",Emotional Reasoning,Personalization
"She yawned, so I'm annoying her, because I'm a nuisance.",Jumping to Conclusions,Labeling
"I feel lonely, so nobody loves me, and people should reach out to me.",Emotional Reasoning,Should Statements
